<?xml version="1.0"?>
<ModuleDefinition xmlns:xsi='http://www.w3.org/2001/XMLSchema-instance' xsi:schemaLocation="luna:schema ../../PartSyncSchema.xsd">
	<Fields>
		<FieldDefinition>
			<FieldName>productionSpeed</FieldName>
			<MaxIntervalInMs>250</MaxIntervalInMs>
		</FieldDefinition>
		<FieldDefinition>
			<FieldName>dumpOxygen</FieldName>
			<MaxIntervalInMs>250</MaxIntervalInMs>
		</FieldDefinition>
	</Fields>
</ModuleDefinition>