<?xml version="1.0"?>
<ModuleDefinition xmlns:xsi='http://www.w3.org/2001/XMLSchema-instance' xsi:schemaLocation="luna:schema ../../PartSyncSchema.xsd">
	<Fields>
		<FieldDefinition>
			<FieldName>IsEnabled</FieldName>
		</FieldDefinition>
		<FieldDefinition>
			<FieldName>IsCharging</FieldName>
		</FieldDefinition>
		<FieldDefinition>
			<FieldName>existing_warp_speed</FieldName>
		</FieldDefinition>
		<FieldDefinition>
			<FieldName>selected_factor</FieldName>
		</FieldDefinition>
		<FieldDefinition>
			<FieldName>target_factor</FieldName>
		</FieldDefinition>
		<FieldDefinition>
			<FieldName>isupgraded</FieldName>
		</FieldDefinition>
		<FieldDefinition>
			<FieldName>serialisedwarpvector</FieldName>
		</FieldDefinition>
		<FieldDefinition>
			<FieldName>spaceSafetyDistance</FieldName>
		</FieldDefinition>
		<FieldDefinition>
			<FieldName>antigravityPercentage</FieldName>
		</FieldDefinition>
		<FieldDefinition>
			<FieldName>matchExitToDestinationSpeed</FieldName>
		</FieldDefinition>
		<FieldDefinition>
			<FieldName>maximizeWarpSpeed</FieldName>
		</FieldDefinition>
		<FieldDefinition>
			<FieldName>holdAltitude</FieldName>
		</FieldDefinition>
		<FieldDefinition>
			<FieldName>IsSlave</FieldName>
		</FieldDefinition>
	</Fields>
	<Methods>
		<MethodDefinition>
			<MethodName>StartCharging</MethodName>
		</MethodDefinition>
		<MethodDefinition>
			<MethodName>StopCharging</MethodName>
		</MethodDefinition>
		<MethodDefinition>
			<MethodName>ActivateWarpDrive</MethodName>
		</MethodDefinition>
		<MethodDefinition>
			<MethodName>DeactivateWarpDrive</MethodName>
		</MethodDefinition>
		<MethodDefinition>
			<MethodName>ReduceWarpPower</MethodName>
		</MethodDefinition>
		<MethodDefinition>
			<MethodName>RetrofitDrive</MethodName>
		</MethodDefinition>
	</Methods>
</ModuleDefinition>