<?xml version="1.0"?>
<ModuleDefinition xmlns:xsi='http://www.w3.org/2001/XMLSchema-instance' xsi:schemaLocation="luna:schema ../../PartSyncSchema.xsd">
	<Fields>
		<FieldDefinition>
			<FieldName>storedAbsoluteFactor</FieldName>
		</FieldDefinition>
		<FieldDefinition>
			<FieldName>storedFractionThermalReciever</FieldName>
		</FieldDefinition>
		<FieldDefinition>
			<FieldName>IsEnabled</FieldName>
		</FieldDefinition>
		<FieldDefinition>
			<FieldName>isupgraded</FieldName>
		</FieldDefinition>
		<FieldDefinition>
			<FieldName>fuel_mode</FieldName>
		</FieldDefinition>
		<FieldDefinition>
			<FieldName>isDeployed</FieldName>
		</FieldDefinition>
		<FieldDefinition>
			<FieldName>animationStarted</FieldName>
		</FieldDefinition>
		<FieldDefinition>
			<FieldName>exhaustAllowed</FieldName>
		</FieldDefinition>
		<FieldDefinition>
			<FieldName>canActivatePowerSource</FieldName>
		</FieldDefinition>
		<FieldDefinition>
			<FieldName>ispThrottle</FieldName>
		</FieldDefinition>
		<FieldDefinition>
			<FieldName>fuelFlowThrottle</FieldName>
		</FieldDefinition>
		<FieldDefinition>
			<FieldName>mhdPowerGenerationPercentage</FieldName>
		</FieldDefinition>
		<FieldDefinition>
			<FieldName>sootAccumulationPercentage</FieldName>
		</FieldDefinition>
		<FieldDefinition>
			<FieldName>jetSpoolRatio</FieldName>
		</FieldDefinition>
	</Fields>
	<Methods>
		<MethodDefinition>
			<MethodName>NextPropellant</MethodName>
		</MethodDefinition>
		<MethodDefinition>
			<MethodName>PreviousPropellant</MethodName>
		</MethodDefinition>
		<MethodDefinition>
			<MethodName>RetrofitEngine</MethodName>
		</MethodDefinition>
	</Methods>
</ModuleDefinition>