<?xml version="1.0"?>
<ModuleDefinition xmlns:xsi='http://www.w3.org/2001/XMLSchema-instance' xsi:schemaLocation="luna:schema ../../PartSyncSchema.xsd">
	<Fields>
		<FieldDefinition>
			<FieldName>vesselCaptureEnabled</FieldName>
		</FieldDefinition>
		<FieldDefinition>
			<FieldName>lastUpdateTime</FieldName>
		</FieldDefinition>
		<FieldDefinition>
			<FieldName>currentJob</FieldName>
		</FieldDefinition>
	</Fields>
	<Methods>
		<MethodDefinition>
			<MethodName>ToggleActiveState</MethodName>
		</MethodDefinition>
	</Methods>
</ModuleDefinition>