<?xml version="1.0"?>
<ModuleDefinition xmlns:xsi='http://www.w3.org/2001/XMLSchema-instance' xsi:schemaLocation="luna:schema ../../PartSyncSchema.xsd">
	<Fields>
		<FieldDefinition>
			<FieldName>cornerCount</FieldName>
		</FieldDefinition>
		<FieldDefinition>
			<FieldName>diameter</FieldName>
		</FieldDefinition>
		<FieldDefinition>
			<FieldName>length</FieldName>
		</FieldDefinition>
		<FieldDefinition>
			<FieldName>OuterDiameter</FieldName>
		</FieldDefinition>
	</Fields>
</ModuleDefinition>