<?xml version="1.0"?>
<ModuleDefinition xmlns:xsi='http://www.w3.org/2001/XMLSchema-instance' xsi:schemaLocation="luna:schema ../../PartSyncSchema.xsd">
	<Fields>
		<FieldDefinition>
			<FieldName>powerGeneratorPowerInput</FieldName>
		</FieldDefinition>
		<FieldDefinition>
			<FieldName>powerGeneratorPowerOutput</FieldName>
		</FieldDefinition>
		<FieldDefinition>
			<FieldName>last_active_time</FieldName>
		</FieldDefinition>
		<FieldDefinition>
			<FieldName>initialMaxBufferSize</FieldName>
		</FieldDefinition>
		<FieldDefinition>
			<FieldName>initialInputAmount</FieldName>
		</FieldDefinition>
		<FieldDefinition>
			<FieldName>initialOutputAmount</FieldName>
		</FieldDefinition>
	</Fields>
</ModuleDefinition>