<?xml version="1.0"?>
<ModuleDefinition xmlns:xsi='http://www.w3.org/2001/XMLSchema-instance' xsi:schemaLocation="luna:schema ../../PartSyncSchema.xsd">
	<Fields>
		<FieldDefinition>
			<FieldName>originalMass</FieldName>
		</FieldDefinition>
		<FieldDefinition>
			<FieldName>previousMass</FieldName>
		</FieldDefinition>
		<FieldDefinition>
			<FieldName>currentStorageCapacity</FieldName>
		</FieldDefinition>
	</Fields>
	<Methods>
		<MethodDefinition>
			<MethodName>SetObjectResources</MethodName>
		</MethodDefinition>
	</Methods>
</ModuleDefinition>