<?xml version="1.0"?>
<ModuleDefinition xmlns:xsi='http://www.w3.org/2001/XMLSchema-instance' xsi:schemaLocation="luna:schema ../../PartSyncSchema.xsd">
	<Fields>
		<FieldDefinition>
			<FieldName>tankVolume</FieldName>
		</FieldDefinition>
		<FieldDefinition>
			<FieldName>mass</FieldName>
		</FieldDefinition>
		<FieldDefinition>
			<FieldName>tankType</FieldName>
		</FieldDefinition>
	</Fields>
	<Methods>
		<MethodDefinition>
			<MethodName>OnPartVolumeChanged</MethodName>
		</MethodDefinition>
	</Methods>
</ModuleDefinition>