<?xml version="1.0"?>
<ModuleDefinition xmlns:xsi='http://www.w3.org/2001/XMLSchema-instance' xsi:schemaLocation="luna:schema ../../PartSyncSchema.xsd">
	<Fields>
		<FieldDefinition>
			<FieldName>managerState</FieldName>
		</FieldDefinition>
		<FieldDefinition>
			<FieldName>sequenceID</FieldName>
		</FieldDefinition>
		<FieldDefinition>
			<FieldName>snapshotID</FieldName>
		</FieldDefinition>
	</Fields>
</ModuleDefinition>