<?xml version="1.0"?>
<ModuleDefinition xmlns:xsi='http://www.w3.org/2001/XMLSchema-instance' xsi:schemaLocation="luna:schema ../../PartSyncSchema.xsd">
	<Fields>
		<FieldDefinition>
			<FieldName>magnetActivated</FieldName>
		</FieldDefinition>
	</Fields>
	<Methods>
		<MethodDefinition>
			<MethodName>ActivateMagnet</MethodName>
		</MethodDefinition>
		<MethodDefinition>
			<MethodName>DeactivateMagnet</MethodName>
		</MethodDefinition>
	</Methods>
</ModuleDefinition>