<?xml version="1.0"?>
<ModuleDefinition xmlns:xsi='http://www.w3.org/2001/XMLSchema-instance' xsi:schemaLocation="luna:schema ../../PartSyncSchema.xsd">
	<Fields>
		<FieldDefinition>
			<FieldName>radiatorInit</FieldName>
		</FieldDefinition>
		<FieldDefinition>
			<FieldName>showRetractButton</FieldName>
		</FieldDefinition>
		<FieldDefinition>
			<FieldName>showControls</FieldName>
		</FieldDefinition>
		<FieldDefinition>
			<FieldName>currentRadTemp</FieldName>
		</FieldDefinition>
		<FieldDefinition>
			<FieldName>clarifyFunction</FieldName>
		</FieldDefinition>
		<FieldDefinition>
			<FieldName>radiatorIsEnabled</FieldName>
		</FieldDefinition>
		<FieldDefinition>
			<FieldName>isAutomated</FieldName>
		</FieldDefinition>
		<FieldDefinition>
			<FieldName>pivotEnabled</FieldName>
		</FieldDefinition>
		<FieldDefinition>
			<FieldName>preventShieldedDeploy</FieldName>
		</FieldDefinition>
	</Fields>
	<Methods>
		<MethodDefinition>
			<MethodName>DeployRadiator</MethodName>
		</MethodDefinition>
		<MethodDefinition>
			<MethodName>RetractRadiator</MethodName>
		</MethodDefinition>
	</Methods>
</ModuleDefinition>