<?xml version="1.0"?>
<ModuleDefinition xmlns:xsi='http://www.w3.org/2001/XMLSchema-instance' xsi:schemaLocation="luna:schema ../../PartSyncSchema.xsd">
	<Fields>
		<FieldDefinition>
			<FieldName>crossfeed</FieldName>
		</FieldDefinition>
	</Fields>
	<Methods>
		<MethodDefinition>
			<MethodName>TogglePort</MethodName>
		</MethodDefinition>
		<MethodDefinition>
			<MethodName>EnableXFeed</MethodName>
		</MethodDefinition>
		<MethodDefinition>
			<MethodName>DisableXFeed</MethodName>
		</MethodDefinition>
	</Methods>
</ModuleDefinition>